timestamp,ticker,BUY/SELL,Signal,AI score,Sent,RSI,Vlty,F-Score,Conf,is_healthy,price,status,AI
2026-02-25T14:59:27.135073-05:00,CEG,SELL,Signal: STAR_EXIT_SELL_PARTIAL_50,AI: 85,-0.12,63.73,0.2315,7,85,True,326.90,FILLED_CONFIRMED,"CEG is down 17% year-to-date with retail investor sentiment cooling significantly from bullish to neutral caution. While the RSI at 63.7 shows some momentum, the stock is overextended with a 15.7% stretch from its 20-day SMA, indicating potential for a pullback. Mizuho recently lowered its price target to $330, and there's no insider buying, reinforcing a cautious outlook despite positive future power price projections for 2025."
2026-02-25T13:37:12.853245-05:00,LLY,BUY,Signal: STAR_PROACTIVE_STAR_ENTRY,AI: 90,0.50,,0.0876,8,90,True,1033.87,FILLED_CONFIRMED,"LLY presents a strong positive fundamental narrative with successful Phase 3 trials (VIVID-2) and demonstrated resilience in the GLP-1 market against competitor price cuts. The analyst consensus, while 'Neutral', includes a high target of $1350, suggesting significant upside potential. Technical indicators (RSI 50.0, SMA-20 0%), institutional flow, and insider momentum are all neutral, indicating that while fundamental news is very strong, a clear immediate catalyst for accelerated movement is absent from market sentiment or technicals. The broader bearish QQQ trend introduces a minor cautious note, but the company-specific positive news and long-term growth outlook are compelling."
2026-02-25T12:43:12.178952-05:00,ASML,BUY,Signal: MOMENTUM_BREAKOUT,AI: 90,0.50,,0.1201,8,90,True,1532.19,FILLED_CONFIRMED,"ASML's explicit identification of AI as the main long-term growth driver, a significant shift from previous reports, provides strong fundamental tailwinds. This is reinforced by its inclusion in Goldman Sachs' list of outperforming capital-intensive companies, suggesting resilience during market shifts. Despite neutral technicals (RSI 50.0, SMA-20 stretch 0%), neutral analyst consensus, and a bearish QQQ trend, the strong positive fundamental narrative change suggests upside potential, aligning with the hard-learned lesson to prioritize robust long-term demand and fundamental strength over mixed or neutral short-term sentiment."
2026-02-25T12:39:08.190201-05:00,ASML,BUY,Signal: MOMENTUM_BREAKOUT,AI: 90,0.50,,0.1191,8,90,True,1530.31,FILLED_CONFIRMED,"ASML's updated 2025 annual report explicitly identifies AI demand as the main long-term growth driver, a significant shift in company outlook from 2024, indicating strong fundamental tailwinds. Additionally, ASML is included in Goldman Sachs' outperforming 'capital-intensive' basket, suggesting resilience and investor preference in the current market. Technicals (RSI 50.0, SMA-20 Stretch 0%), analyst consensus (Neutral), and institutional flow are all neutral. Despite a bearish QQQ trend, the strong, positive company-specific fundamental news provides a high-conviction buy signal."
2026-02-25T11:47:11.853701-05:00,AMD,BUY,Signal: STAR_PROACTIVE_STAR_ENTRY,AI: 85,0.68,48.84,0.3494,7,85,True,213.20,FILLED_CONFIRMED,"High conviction for upside driven by the highly impactful news of AMD's multi-year, $100 billion AI chip supply agreement with Meta, as projected by Piper Sandler. This significant revenue catalyst is further supported by new partnerships (TensorWave) and a general rebound in tech stocks with easing AI fears. While technicals (RSI 48.8, SMA-20 -1.15%), analyst consensus, institutional flow, and insider momentum are neutral, and the broader QQQ trend is bearish, the overwhelming positive company-specific news acts as a major catalyst that overrides these neutral/mixed signals, consistent with past lessons that major positive catalysts can drive stock performance irrespective of isolated broader market or neutral signals."
2026-02-25T11:01:22.256684-05:00,AMD,BUY,Signal: STAR_PROACTIVE_STAR_ENTRY,AI: 85,0.67,,0.3627,7,85,True,211.70,FILLED_CONFIRMED,"AMD exhibits strong positive conviction driven by the highly significant multi-year Meta deal, projected to generate an additional $100 billion in revenue over the next five years, and a new partnership with TensorWave for AMD-based AI clusters. These substantial catalysts position AMD favorably within the strong AI thematic tailwind. While technical indicators (RSI 50, SMA-20 0% stretch), analyst consensus, and institutional flow are neutral, and insider buying is absent, the sheer magnitude of the Meta deal suggests significant future upside that may not be fully priced in yet. The QQQ's 'Bearish' trend provides a minor macro headwind, but is overshadowed by the powerful company-specific news."
2026-02-25T10:07:20.188344-05:00,LMT,BUY,CONVICTION_ROTATION,,0.35,,0.1235,5,85,True,636.50,FILLED,"Technical indicators (RSI 50.0, SMA-20 Stretch 0%) are perfectly neutral. Analyst consensus, institutional flow, and insider momentum (0.0% buy-side) are also neutral to slightly negative. However, news sentiment is strongly positive, highlighting significant new contracts for C-130J simulators, potential for increased F-35 orders from Germany, and expansion of THAAD/PAC-3 missile interceptor production. These concrete business catalysts suggest future revenue growth not yet reflected in neutral market sentiment or technicals, indicating a moderate upside potential."
2026-02-25T10:07:18.750758-05:00,MU,SELL,CONVICTION_SWAP,,0.20,61.71,0.1776,7,45,True,432.47,FILLED_CONFIRMED,"Strong insider buy-side activity (4.3% over 70 trades) combined with overwhelmingly bullish news highlighting 'strong fundamentals' and 'bullish technical momentum' and a 300% gain over the last year. Technicals indicate robust upward momentum (RSI 61.7, SMA-20 Stretch 5.29%). Despite a bearish QQQ trend and a neutral analyst consensus, the potent positive drivers, including a major upcoming earnings catalyst, suggest high conviction."
